{
  "channel": "alpha",
  "publisher": "knoxhack",
  "sourceRepo": "knoxhack/ECHO-Modules",
  "releaseTag": "modules-all-official-modpacks-install-fix-20260613",
  "commitSha": "a2e0823ba175b79be9a67031f7b6da77159720a1",
  "trust": "source-linked",
  "validation": "approved",
  "id": "echoblackboxprotocol",
  "kind": "module",
  "version": "1.0.0",
  "artifacts": {
    "neoforge": {
      "file": "echoblackboxprotocol-1.0.0-neoforge.jar",
      "sha256": "6fcf170bdc06a75bbb33261638bd54a6a4c0baece792190942bbf723df5a49f1",
      "url": "https://github.com/knoxhack/ECHO-Modules/releases/download/modules-all-official-modpacks-install-fix-20260613/echoblackboxprotocol-1.0.0-neoforge.jar",
      "size": 10846262,
      "buildMode": "compiled-runtime"
    },
    "standalone": {
      "file": "echoblackboxprotocol-1.0.0-standalone.jar",
      "sha256": "ea67b6b3c7f374caa27b1c820561a00a2a96662d23a7b5a8b6d9c118ed13a8bf",
      "url": "https://github.com/knoxhack/ECHO-Modules/releases/download/modules-all-official-modpacks-install-fix-20260613/echoblackboxprotocol-1.0.0-standalone.jar",
      "size": 10846243,
      "buildMode": "compiled-runtime"
    },
    "native": {
      "file": "echoblackboxprotocol-1.0.0.echo-addon",
      "sha256": "845049c998265a19dbd59fe5305bb7bd6ecaaf04f2b5a196b7ac1aba5daf5155",
      "url": "https://github.com/knoxhack/ECHO-Modules/releases/download/modules-all-official-modpacks-install-fix-20260613/echoblackboxprotocol-1.0.0.echo-addon",
      "size": 10779580,
      "buildMode": "compiled-runtime"
    },
    "sources": {
      "file": "echoblackboxprotocol-1.0.0-sources.jar",
      "sha256": "5fc5d74c22165e1629ffe8810eea868ed9196220e2efef879aaa254104ad4462",
      "url": "https://github.com/knoxhack/ECHO-Modules/releases/download/modules-all-official-modpacks-install-fix-20260613/echoblackboxprotocol-1.0.0-sources.jar",
      "size": 10740170
    }
  },
  "dependencies": [
    {
      "id": "echoadaptercore",
      "kind": "module"
    },
    {
      "id": "echocore",
      "kind": "module"
    },
    {
      "id": "echonetcore",
      "kind": "module"
    }
  ],
  "compatibility": [
    "ashfall-native-edition",
    "ashfall-neoforge-edition",
    "ashfall-standalone-edition",
    "sky-relay-native-edition",
    "sky-relay-neoforge-edition",
    "sky-relay-standalone-edition",
    "galactic-survey-native-edition",
    "galactic-survey-neoforge-edition",
    "galactic-survey-standalone-edition",
    "openlands-native-edition",
    "openlands-neoforge-edition",
    "openlands-standalone-edition",
    "arcana-division-native-edition",
    "arcana-division-neoforge-edition",
    "arcana-division-standalone-edition"
  ]
}
