{
  "id": "echoinputcore",
  "kind": "module",
  "version": "1.0.0",
  "channel": "alpha",
  "publisher": "knoxhack",
  "sourceRepo": "knoxhack/ECHO-Modules",
  "releaseTag": "modules-content-graph-evidence-v1-20260616",
  "commitSha": "a62694cc0d6dab2d5b219efb148e376599452275",
  "artifacts": {
    "neoforge": {
      "file": "echoinputcore-1.0.0-neoforge.jar",
      "sha256": "e7e51b8fcaf55c398dfb729afebf1ea4051ef4f33b9f88473282238e2bfdc56a",
      "size": 26653,
      "runtimeTarget": "neoforge",
      "buildMode": "compiled-runtime",
      "contains": [
        "META-INF/echo.mod.json",
        "META-INF/neoforge.mods.toml",
        ".echo/content-graph/content-graph.json",
        ".echo/content-graph/content-graph.md",
        ".echo/content-graph/export-plans/echo_native.json",
        ".echo/content-graph/export-plans/echo_runtime_standalone.json",
        ".echo/content-graph/export-plans/hytale.json",
        ".echo/content-graph/export-plans/neoforge.json",
        ".echo/content-graph/features.json",
        ".echo/content-graph/provenance.json",
        ".echo/content-graph/unresolved-references.json"
      ],
      "url": "https://github.com/knoxhack/ECHO-Modules/releases/download/modules-content-graph-evidence-v1-20260616/echoinputcore-1.0.0-neoforge.jar"
    },
    "standalone": {
      "file": "echoinputcore-1.0.0-standalone.jar",
      "sha256": "e7e51b8fcaf55c398dfb729afebf1ea4051ef4f33b9f88473282238e2bfdc56a",
      "size": 26653,
      "runtimeTarget": "standalone",
      "buildMode": "compiled-runtime",
      "contains": [
        "META-INF/echo.mod.json",
        ".echo/content-graph/content-graph.json",
        ".echo/content-graph/content-graph.md",
        ".echo/content-graph/export-plans/echo_native.json",
        ".echo/content-graph/export-plans/echo_runtime_standalone.json",
        ".echo/content-graph/export-plans/hytale.json",
        ".echo/content-graph/export-plans/neoforge.json",
        ".echo/content-graph/features.json",
        ".echo/content-graph/provenance.json",
        ".echo/content-graph/unresolved-references.json"
      ],
      "url": "https://github.com/knoxhack/ECHO-Modules/releases/download/modules-content-graph-evidence-v1-20260616/echoinputcore-1.0.0-standalone.jar"
    },
    "native": {
      "file": "echoinputcore-1.0.0.echo-addon",
      "sha256": "5bb2ac6605c7fa70c2c29a31b71c6b2c9b458e9c0c5665e1e87eb5c8d718848e",
      "size": 28308,
      "runtimeTarget": "echo-native",
      "buildMode": "compiled-runtime",
      "contains": [
        "META-INF/echo.mod.json",
        "echo-addon-package.json",
        "checksums.sha256",
        ".echo/content-graph/content-graph.json",
        ".echo/content-graph/content-graph.md",
        ".echo/content-graph/export-plans/echo_native.json",
        ".echo/content-graph/export-plans/echo_runtime_standalone.json",
        ".echo/content-graph/export-plans/hytale.json",
        ".echo/content-graph/export-plans/neoforge.json",
        ".echo/content-graph/features.json",
        ".echo/content-graph/provenance.json",
        ".echo/content-graph/unresolved-references.json"
      ],
      "url": "https://github.com/knoxhack/ECHO-Modules/releases/download/modules-content-graph-evidence-v1-20260616/echoinputcore-1.0.0.echo-addon"
    },
    "sources": {
      "file": "echoinputcore-1.0.0-sources.jar",
      "sha256": "46ebf4e19192e517d54de260f23b20ae3da7f84af3a3fa6b046500eb5f40ceb1",
      "size": 12242,
      "runtimeTarget": "sources",
      "contains": [
        "META-INF/echo.mod.json"
      ],
      "url": "https://github.com/knoxhack/ECHO-Modules/releases/download/modules-content-graph-evidence-v1-20260616/echoinputcore-1.0.0-sources.jar"
    },
    "content-graph": {
      "file": "echoinputcore-1.0.0-content-graph.json",
      "sha256": "1285e85263591f8ba82e0585f0a7ddf373c181add37437c559d5ed151b0780fc",
      "size": 14809,
      "runtimeTarget": "content-graph",
      "buildMode": "generated",
      "contains": [
        ".echo/content-graph/content-graph.json"
      ],
      "url": "https://github.com/knoxhack/ECHO-Modules/releases/download/modules-content-graph-evidence-v1-20260616/echoinputcore-1.0.0-content-graph.json"
    },
    "content-graph-evidence": {
      "file": "content-graph-evidence.json",
      "sha256": "a081fa19639024cdd8f416c694f82e6fedcd01417abad92a82ad13783cf7f1b9",
      "size": 63462,
      "runtimeTarget": "content-graph",
      "buildMode": "generated",
      "contains": [],
      "schemaVersion": "echo.content_graph.evidence.v1",
      "url": "https://github.com/knoxhack/ECHO-Modules/releases/download/modules-content-graph-evidence-v1-20260616/content-graph-evidence.json",
      "artifactRole": "content-graph-evidence"
    }
  },
  "dependencies": [
    {
      "id": "echoadaptercore",
      "kind": "module",
      "version": "*"
    },
    {
      "id": "echoassetcore",
      "kind": "module",
      "version": "*"
    },
    {
      "id": "echocontentcore",
      "kind": "module",
      "version": "*"
    },
    {
      "id": "echocore",
      "kind": "module",
      "version": "*"
    },
    {
      "id": "echoplatformcore",
      "kind": "module",
      "version": "*"
    },
    {
      "id": "echoschemacore",
      "kind": "module",
      "version": "*"
    },
    {
      "id": "echovalidationcore",
      "kind": "module",
      "version": "*"
    }
  ],
  "compatibility": [
    "ashfall-neoforge-edition",
    "ashfall-standalone-edition",
    "ashfall-native-edition"
  ],
  "provenance": {
    "sourceRepo": "knoxhack/ECHO-Modules",
    "commitSha": "a62694cc0d6dab2d5b219efb148e376599452275",
    "workflow": "Release Modules",
    "workflowRef": "knoxhack/ECHO-Modules/.github/workflows/release-modules.yml@refs/heads/main",
    "generatedBy": "scripts/generate-module-release.mjs",
    "attestation": {
      "action": "actions/attest@v4",
      "subjectChecksums": "echo-module-release.tar.gz.sha256"
    }
  },
  "trust": "provenance-attested",
  "validation": "approved"
}
