{
  "id": "echoruincore",
  "kind": "module",
  "version": "0.1.0",
  "channel": "alpha",
  "publisher": "knoxhack",
  "sourceRepo": "knoxhack/ECHO-Modules",
  "releaseTag": "modules-content-graph-evidence-repro-20260616",
  "commitSha": "aff012aaa427f6f8b5eaf10e145207739b1602b7",
  "artifacts": {
    "neoforge": {
      "file": "echoruincore-0.1.0-neoforge.jar",
      "sha256": "da8c5a52224437a2bddaddf45cd6b025f9a53b2ba78e3143a1e8310d44cddd08",
      "size": 11607,
      "runtimeTarget": "neoforge",
      "buildMode": "compiled-runtime",
      "contains": [
        "META-INF/echo.mod.json",
        "META-INF/neoforge.mods.toml",
        ".echo/content-graph/content-graph.json",
        ".echo/content-graph/content-graph.md",
        ".echo/content-graph/export-plans/echo_native.json",
        ".echo/content-graph/export-plans/echo_runtime_standalone.json",
        ".echo/content-graph/export-plans/hytale.json",
        ".echo/content-graph/export-plans/neoforge.json",
        ".echo/content-graph/features.json",
        ".echo/content-graph/provenance.json",
        ".echo/content-graph/unresolved-references.json"
      ],
      "url": "https://github.com/knoxhack/ECHO-Modules/releases/download/modules-content-graph-evidence-repro-20260616/echoruincore-0.1.0-neoforge.jar"
    },
    "standalone": {
      "file": "echoruincore-0.1.0-standalone.jar",
      "sha256": "da8c5a52224437a2bddaddf45cd6b025f9a53b2ba78e3143a1e8310d44cddd08",
      "size": 11607,
      "runtimeTarget": "standalone",
      "buildMode": "compiled-runtime",
      "contains": [
        "META-INF/echo.mod.json",
        ".echo/content-graph/content-graph.json",
        ".echo/content-graph/content-graph.md",
        ".echo/content-graph/export-plans/echo_native.json",
        ".echo/content-graph/export-plans/echo_runtime_standalone.json",
        ".echo/content-graph/export-plans/hytale.json",
        ".echo/content-graph/export-plans/neoforge.json",
        ".echo/content-graph/features.json",
        ".echo/content-graph/provenance.json",
        ".echo/content-graph/unresolved-references.json"
      ],
      "url": "https://github.com/knoxhack/ECHO-Modules/releases/download/modules-content-graph-evidence-repro-20260616/echoruincore-0.1.0-standalone.jar"
    },
    "native": {
      "file": "echoruincore-0.1.0.echo-addon",
      "sha256": "47675c5670dd1fa3ec88d092c4352a9196ddf4e20d347d08066aa882d252ec78",
      "size": 14451,
      "runtimeTarget": "echo-native",
      "buildMode": "compiled-runtime",
      "contains": [
        "META-INF/echo.mod.json",
        "echo-addon-package.json",
        "checksums.sha256",
        ".echo/content-graph/content-graph.json",
        ".echo/content-graph/content-graph.md",
        ".echo/content-graph/export-plans/echo_native.json",
        ".echo/content-graph/export-plans/echo_runtime_standalone.json",
        ".echo/content-graph/export-plans/hytale.json",
        ".echo/content-graph/export-plans/neoforge.json",
        ".echo/content-graph/features.json",
        ".echo/content-graph/provenance.json",
        ".echo/content-graph/unresolved-references.json"
      ],
      "url": "https://github.com/knoxhack/ECHO-Modules/releases/download/modules-content-graph-evidence-repro-20260616/echoruincore-0.1.0.echo-addon"
    },
    "sources": {
      "file": "echoruincore-0.1.0-sources.jar",
      "sha256": "c751616e4f322025ad76c1bd2d4c6f9ea2f7cec84f0d184dfd40a2efa22954c5",
      "size": 5587,
      "runtimeTarget": "sources",
      "contains": [
        "META-INF/echo.mod.json"
      ],
      "url": "https://github.com/knoxhack/ECHO-Modules/releases/download/modules-content-graph-evidence-repro-20260616/echoruincore-0.1.0-sources.jar"
    },
    "content-graph": {
      "file": "echoruincore-0.1.0-content-graph.json",
      "sha256": "02accf15eed31d749eec4ddc1ff81e9fe27b5060f6d885184dc23f3a04366ba3",
      "size": 18615,
      "runtimeTarget": "content-graph",
      "buildMode": "generated",
      "contains": [
        ".echo/content-graph/content-graph.json"
      ],
      "url": "https://github.com/knoxhack/ECHO-Modules/releases/download/modules-content-graph-evidence-repro-20260616/echoruincore-0.1.0-content-graph.json"
    },
    "content-graph-evidence": {
      "file": "content-graph-evidence.json",
      "sha256": "e366172d6fb5d09e6d9cb749698ac51bd536ba6fcd2f84c1cf0ab5169665aa20",
      "size": 63462,
      "runtimeTarget": "content-graph",
      "buildMode": "generated",
      "contains": [],
      "schemaVersion": "echo.content_graph.evidence.v1",
      "url": "https://github.com/knoxhack/ECHO-Modules/releases/download/modules-content-graph-evidence-repro-20260616/content-graph-evidence.json",
      "artifactRole": "content-graph-evidence"
    }
  },
  "dependencies": [
    {
      "id": "echocore",
      "kind": "module",
      "version": "*"
    },
    {
      "id": "echoadaptercore",
      "kind": "module",
      "version": "*"
    },
    {
      "id": "echostructurecore",
      "kind": "module",
      "version": "*"
    },
    {
      "id": "echolootcore",
      "kind": "module",
      "version": "*"
    },
    {
      "id": "echoworldcore",
      "kind": "module",
      "version": "*"
    }
  ],
  "compatibility": [
    "ashfall-neoforge-edition",
    "ashfall-standalone-edition",
    "ashfall-native-edition"
  ],
  "provenance": {
    "sourceRepo": "knoxhack/ECHO-Modules",
    "commitSha": "aff012aaa427f6f8b5eaf10e145207739b1602b7",
    "workflow": "Release Modules",
    "workflowRef": "knoxhack/ECHO-Modules/.github/workflows/release-modules.yml@refs/heads/main",
    "generatedBy": "scripts/generate-module-release.mjs",
    "attestation": {
      "action": "actions/attest@v4",
      "subjectChecksums": "echo-module-release.tar.gz.sha256"
    }
  },
  "trust": "provenance-attested",
  "validation": "approved"
}
