{
  "channel": "alpha",
  "publisher": "knoxhack",
  "sourceRepo": "knoxhack/ECHO-Modules",
  "releaseTag": "modules-all-official-modpacks-runtime-fix-20260614",
  "commitSha": "c1b43ac48f8fa5065c421781cab4bd1e44418946",
  "trust": "source-linked",
  "validation": "approved",
  "id": "echoencountercore",
  "kind": "module",
  "version": "1.0.0",
  "artifacts": {
    "neoforge": {
      "file": "echoencountercore-1.0.0-neoforge.jar",
      "sha256": "43e3653ba1386f56ddd6400fc0100be07e26a234024ac1fdafdfac080f33a0a7",
      "url": "https://github.com/knoxhack/ECHO-Modules/releases/download/modules-all-official-modpacks-runtime-fix-20260614/echoencountercore-1.0.0-neoforge.jar",
      "size": 21599,
      "buildMode": "compiled-runtime",
      "runtimeTarget": "neoforge",
      "contains": [
        "META-INF/echo.mod.json",
        "META-INF/neoforge.mods.toml"
      ]
    },
    "standalone": {
      "file": "echoencountercore-1.0.0-standalone.jar",
      "sha256": "12c513e46fe7558d7ccd78a86fb0e23ffcec5dd4eaba4d6b1eccfd41a5e5e327",
      "url": "https://github.com/knoxhack/ECHO-Modules/releases/download/modules-all-official-modpacks-runtime-fix-20260614/echoencountercore-1.0.0-standalone.jar",
      "size": 21576,
      "buildMode": "compiled-runtime",
      "runtimeTarget": "standalone",
      "contains": [
        "META-INF/echo.mod.json"
      ]
    },
    "native": {
      "file": "echoencountercore-1.0.0.echo-addon",
      "sha256": "f6b27a2c2b80decd6c4fe1405f9a12af408117efc8d95866ef04c8d519e974a3",
      "url": "https://github.com/knoxhack/ECHO-Modules/releases/download/modules-all-official-modpacks-runtime-fix-20260614/echoencountercore-1.0.0.echo-addon",
      "size": 22699,
      "buildMode": "compiled-runtime",
      "runtimeTarget": "echo-native",
      "contains": [
        "META-INF/echo.mod.json",
        "echo-addon-package.json",
        "checksums.sha256"
      ]
    },
    "sources": {
      "file": "echoencountercore-1.0.0-sources.jar",
      "sha256": "b6a3f5be57169fa272836d852cc53bf96b13e6c71540acaaacae4dba88774392",
      "url": "https://github.com/knoxhack/ECHO-Modules/releases/download/modules-all-official-modpacks-runtime-fix-20260614/echoencountercore-1.0.0-sources.jar",
      "size": 11390,
      "runtimeTarget": "sources",
      "contains": [
        "META-INF/echo.mod.json"
      ]
    },
    "content-graph": {
      "file": "echoencountercore-1.0.0-content-graph.json",
      "sha256": "f54209e79a0254cb7472b5ba9e5c4e1e99919ee686cde2c3c02310bab371fbe7",
      "size": 14906,
      "url": "https://github.com/knoxhack/ECHO-Modules/releases/download/modules-all-official-modpacks-runtime-fix-20260614/echoencountercore-1.0.0-content-graph.json",
      "runtimeTarget": "content-graph",
      "buildMode": "generated",
      "contains": [
        ".echo/content-graph/content-graph.json"
      ]
    }
  },
  "dependencies": [
    {
      "id": "echoadaptercore",
      "kind": "module"
    },
    {
      "id": "echocontentcore",
      "kind": "module"
    },
    {
      "id": "echocore",
      "kind": "module"
    },
    {
      "id": "echoplatformcore",
      "kind": "module"
    },
    {
      "id": "echoschemacore",
      "kind": "module"
    },
    {
      "id": "echovalidationcore",
      "kind": "module"
    }
  ],
  "compatibility": []
}
