{
  "id": "signalosexample",
  "kind": "module",
  "version": "1.0.0",
  "channel": "alpha",
  "publisher": "knoxhack",
  "sourceRepo": "knoxhack/ECHO-Modules",
  "releaseTag": "modules-content-graph-evidence-v1-20260616",
  "commitSha": "a62694cc0d6dab2d5b219efb148e376599452275",
  "artifacts": {
    "neoforge": {
      "file": "signalosexample-1.0.0-neoforge.jar",
      "sha256": "0bc78292c95a4f99f27d5b49e3717a062225f489b66945493c53ae671bd5b71c",
      "size": 18652,
      "runtimeTarget": "neoforge",
      "buildMode": "compiled-runtime",
      "contains": [
        "META-INF/echo.mod.json",
        "META-INF/neoforge.mods.toml",
        ".echo/content-graph/content-graph.json",
        ".echo/content-graph/content-graph.md",
        ".echo/content-graph/export-plans/echo_native.json",
        ".echo/content-graph/export-plans/echo_runtime_standalone.json",
        ".echo/content-graph/export-plans/hytale.json",
        ".echo/content-graph/export-plans/neoforge.json",
        ".echo/content-graph/features.json",
        ".echo/content-graph/provenance.json",
        ".echo/content-graph/unresolved-references.json"
      ],
      "url": "https://github.com/knoxhack/ECHO-Modules/releases/download/modules-content-graph-evidence-v1-20260616/signalosexample-1.0.0-neoforge.jar"
    },
    "standalone": {
      "file": "signalosexample-1.0.0-standalone.jar",
      "sha256": "0bc78292c95a4f99f27d5b49e3717a062225f489b66945493c53ae671bd5b71c",
      "size": 18652,
      "runtimeTarget": "standalone",
      "buildMode": "compiled-runtime",
      "contains": [
        "META-INF/echo.mod.json",
        ".echo/content-graph/content-graph.json",
        ".echo/content-graph/content-graph.md",
        ".echo/content-graph/export-plans/echo_native.json",
        ".echo/content-graph/export-plans/echo_runtime_standalone.json",
        ".echo/content-graph/export-plans/hytale.json",
        ".echo/content-graph/export-plans/neoforge.json",
        ".echo/content-graph/features.json",
        ".echo/content-graph/provenance.json",
        ".echo/content-graph/unresolved-references.json"
      ],
      "url": "https://github.com/knoxhack/ECHO-Modules/releases/download/modules-content-graph-evidence-v1-20260616/signalosexample-1.0.0-standalone.jar"
    },
    "native": {
      "file": "signalosexample-1.0.0.echo-addon",
      "sha256": "e489d99e63ebb32469eb3aa32c26c95253e036be269bbf9b35ba48f7689e8a7c",
      "size": 20583,
      "runtimeTarget": "echo-native",
      "buildMode": "compiled-runtime",
      "contains": [
        "META-INF/echo.mod.json",
        "echo-addon-package.json",
        "checksums.sha256",
        ".echo/content-graph/content-graph.json",
        ".echo/content-graph/content-graph.md",
        ".echo/content-graph/export-plans/echo_native.json",
        ".echo/content-graph/export-plans/echo_runtime_standalone.json",
        ".echo/content-graph/export-plans/hytale.json",
        ".echo/content-graph/export-plans/neoforge.json",
        ".echo/content-graph/features.json",
        ".echo/content-graph/provenance.json",
        ".echo/content-graph/unresolved-references.json"
      ],
      "url": "https://github.com/knoxhack/ECHO-Modules/releases/download/modules-content-graph-evidence-v1-20260616/signalosexample-1.0.0.echo-addon"
    },
    "sources": {
      "file": "signalosexample-1.0.0-sources.jar",
      "sha256": "0e754e29e64f2fadf1aabf4792b685c664701df1cf0b29b0720e1aad482850e1",
      "size": 9420,
      "runtimeTarget": "sources",
      "contains": [
        "META-INF/echo.mod.json"
      ],
      "url": "https://github.com/knoxhack/ECHO-Modules/releases/download/modules-content-graph-evidence-v1-20260616/signalosexample-1.0.0-sources.jar"
    },
    "content-graph": {
      "file": "signalosexample-1.0.0-content-graph.json",
      "sha256": "30971667945ac8603d4e487a76705817b117ce31bc3e7e409a8ef48b518081c4",
      "size": 12490,
      "runtimeTarget": "content-graph",
      "buildMode": "generated",
      "contains": [
        ".echo/content-graph/content-graph.json"
      ],
      "url": "https://github.com/knoxhack/ECHO-Modules/releases/download/modules-content-graph-evidence-v1-20260616/signalosexample-1.0.0-content-graph.json"
    },
    "content-graph-evidence": {
      "file": "content-graph-evidence.json",
      "sha256": "a081fa19639024cdd8f416c694f82e6fedcd01417abad92a82ad13783cf7f1b9",
      "size": 63462,
      "runtimeTarget": "content-graph",
      "buildMode": "generated",
      "contains": [],
      "schemaVersion": "echo.content_graph.evidence.v1",
      "url": "https://github.com/knoxhack/ECHO-Modules/releases/download/modules-content-graph-evidence-v1-20260616/content-graph-evidence.json",
      "artifactRole": "content-graph-evidence"
    }
  },
  "dependencies": [
    {
      "id": "echoadaptercore",
      "kind": "module",
      "version": "*"
    },
    {
      "id": "echocore",
      "kind": "module",
      "version": "*"
    },
    {
      "id": "echonetcore",
      "kind": "module",
      "version": "*"
    },
    {
      "id": "echosignalos",
      "kind": "module",
      "version": "*"
    }
  ],
  "compatibility": [
    "ashfall-neoforge-edition",
    "ashfall-standalone-edition",
    "ashfall-native-edition"
  ],
  "provenance": {
    "sourceRepo": "knoxhack/ECHO-Modules",
    "commitSha": "a62694cc0d6dab2d5b219efb148e376599452275",
    "workflow": "Release Modules",
    "workflowRef": "knoxhack/ECHO-Modules/.github/workflows/release-modules.yml@refs/heads/main",
    "generatedBy": "scripts/generate-module-release.mjs",
    "attestation": {
      "action": "actions/attest@v4",
      "subjectChecksums": "echo-module-release.tar.gz.sha256"
    }
  },
  "trust": "provenance-attested",
  "validation": "approved"
}
