{
  "channel": "alpha",
  "publisher": "knoxhack",
  "sourceRepo": "knoxhack/ECHO-Modules",
  "releaseTag": "modules-all-official-modpacks-runtime-fix-20260614",
  "commitSha": "c1b43ac48f8fa5065c421781cab4bd1e44418946",
  "trust": "source-linked",
  "validation": "approved",
  "id": "echoplaytestcore",
  "kind": "module",
  "version": "0.1.0",
  "artifacts": {
    "neoforge": {
      "file": "echoplaytestcore-0.1.0-neoforge.jar",
      "sha256": "63fe964e0943fc13ce7e31d617142b2dbf18cddcb48902238b1040e1ca8c056b",
      "url": "https://github.com/knoxhack/ECHO-Modules/releases/download/modules-all-official-modpacks-runtime-fix-20260614/echoplaytestcore-0.1.0-neoforge.jar",
      "size": 6619,
      "buildMode": "compiled-runtime",
      "runtimeTarget": "neoforge",
      "contains": [
        "META-INF/echo.mod.json",
        "META-INF/neoforge.mods.toml"
      ]
    },
    "standalone": {
      "file": "echoplaytestcore-0.1.0-standalone.jar",
      "sha256": "63fe964e0943fc13ce7e31d617142b2dbf18cddcb48902238b1040e1ca8c056b",
      "url": "https://github.com/knoxhack/ECHO-Modules/releases/download/modules-all-official-modpacks-runtime-fix-20260614/echoplaytestcore-0.1.0-standalone.jar",
      "size": 6619,
      "buildMode": "compiled-runtime",
      "runtimeTarget": "standalone",
      "contains": [
        "META-INF/echo.mod.json"
      ]
    },
    "native": {
      "file": "echoplaytestcore-0.1.0.echo-addon",
      "sha256": "91edf010563ec0db959d10782c8cc8f006b5a12655eaae945a38ec59d33767b5",
      "url": "https://github.com/knoxhack/ECHO-Modules/releases/download/modules-all-official-modpacks-runtime-fix-20260614/echoplaytestcore-0.1.0.echo-addon",
      "size": 9305,
      "buildMode": "compiled-runtime",
      "runtimeTarget": "echo-native",
      "contains": [
        "META-INF/echo.mod.json",
        "echo-addon-package.json",
        "checksums.sha256"
      ]
    },
    "sources": {
      "file": "echoplaytestcore-0.1.0-sources.jar",
      "sha256": "ecbc09147771c01c2b001c5362cb97aee0c62fb64eb4452b651e158487624e6e",
      "url": "https://github.com/knoxhack/ECHO-Modules/releases/download/modules-all-official-modpacks-runtime-fix-20260614/echoplaytestcore-0.1.0-sources.jar",
      "size": 6252,
      "runtimeTarget": "sources",
      "contains": [
        "META-INF/echo.mod.json"
      ]
    }
  },
  "dependencies": [
    {
      "id": "echocore",
      "kind": "module"
    },
    {
      "id": "echoadaptercore",
      "kind": "module"
    },
    {
      "id": "echoreportcore",
      "kind": "module"
    },
    {
      "id": "echovalidationcore",
      "kind": "module"
    },
    {
      "id": "echomodulegraph",
      "kind": "module"
    },
    {
      "id": "echoruntimeguard",
      "kind": "module"
    }
  ],
  "compatibility": []
}
