{
  "id": "echoplayercore",
  "kind": "module",
  "version": "1.0.0",
  "channel": "alpha",
  "publisher": "knoxhack",
  "sourceRepo": "knoxhack/ECHO-Modules",
  "releaseTag": "modules-content-graph-evidence-proof-20260615",
  "commitSha": "88d17f50dc14915ab3ea21802490bc5e43a69550",
  "artifacts": {
    "neoforge": {
      "file": "echoplayercore-1.0.0-neoforge.jar",
      "sha256": "ca346e2a1a664dc968af8da67cf4896ea64908b4e623d0ecf48bce4fb72b7f41",
      "size": 75003,
      "runtimeTarget": "neoforge",
      "buildMode": "compiled-runtime",
      "contains": [
        "META-INF/echo.mod.json",
        "META-INF/neoforge.mods.toml",
        ".echo/content-graph/content-graph.json",
        ".echo/content-graph/content-graph.md",
        ".echo/content-graph/export-plans/echo_native.json",
        ".echo/content-graph/export-plans/echo_runtime_standalone.json",
        ".echo/content-graph/export-plans/hytale.json",
        ".echo/content-graph/export-plans/neoforge.json",
        ".echo/content-graph/features.json",
        ".echo/content-graph/provenance.json",
        ".echo/content-graph/unresolved-references.json"
      ],
      "url": "https://github.com/knoxhack/ECHO-Modules/releases/download/modules-content-graph-evidence-proof-20260615/echoplayercore-1.0.0-neoforge.jar"
    },
    "standalone": {
      "file": "echoplayercore-1.0.0-standalone.jar",
      "sha256": "ca346e2a1a664dc968af8da67cf4896ea64908b4e623d0ecf48bce4fb72b7f41",
      "size": 75003,
      "runtimeTarget": "standalone",
      "buildMode": "compiled-runtime",
      "contains": [
        "META-INF/echo.mod.json",
        ".echo/content-graph/content-graph.json",
        ".echo/content-graph/content-graph.md",
        ".echo/content-graph/export-plans/echo_native.json",
        ".echo/content-graph/export-plans/echo_runtime_standalone.json",
        ".echo/content-graph/export-plans/hytale.json",
        ".echo/content-graph/export-plans/neoforge.json",
        ".echo/content-graph/features.json",
        ".echo/content-graph/provenance.json",
        ".echo/content-graph/unresolved-references.json"
      ],
      "url": "https://github.com/knoxhack/ECHO-Modules/releases/download/modules-content-graph-evidence-proof-20260615/echoplayercore-1.0.0-standalone.jar"
    },
    "native": {
      "file": "echoplayercore-1.0.0.echo-addon",
      "sha256": "a7a17e34334168c7b31d0e0dff6f055d4eba3c06c03dd49f7de3959302ff5463",
      "size": 74195,
      "runtimeTarget": "echo-native",
      "buildMode": "compiled-runtime",
      "contains": [
        "META-INF/echo.mod.json",
        "echo-addon-package.json",
        "checksums.sha256",
        ".echo/content-graph/content-graph.json",
        ".echo/content-graph/content-graph.md",
        ".echo/content-graph/export-plans/echo_native.json",
        ".echo/content-graph/export-plans/echo_runtime_standalone.json",
        ".echo/content-graph/export-plans/hytale.json",
        ".echo/content-graph/export-plans/neoforge.json",
        ".echo/content-graph/features.json",
        ".echo/content-graph/provenance.json",
        ".echo/content-graph/unresolved-references.json"
      ],
      "url": "https://github.com/knoxhack/ECHO-Modules/releases/download/modules-content-graph-evidence-proof-20260615/echoplayercore-1.0.0.echo-addon"
    },
    "sources": {
      "file": "echoplayercore-1.0.0-sources.jar",
      "sha256": "6eb24fc28341f9e0d83d85d062b6ccf4176a8fd51dc7003da2a368010f108eeb",
      "size": 32097,
      "runtimeTarget": "sources",
      "contains": [
        "META-INF/echo.mod.json"
      ],
      "url": "https://github.com/knoxhack/ECHO-Modules/releases/download/modules-content-graph-evidence-proof-20260615/echoplayercore-1.0.0-sources.jar"
    },
    "content-graph": {
      "file": "echoplayercore-1.0.0-content-graph.json",
      "sha256": "e0541380aebd52a8a5eb3cf14a1f7321895a3987733b6df96a4ec0fe9a6a19d0",
      "size": 22867,
      "runtimeTarget": "content-graph",
      "buildMode": "generated",
      "contains": [
        ".echo/content-graph/content-graph.json"
      ],
      "url": "https://github.com/knoxhack/ECHO-Modules/releases/download/modules-content-graph-evidence-proof-20260615/echoplayercore-1.0.0-content-graph.json"
    },
    "content-graph-evidence": {
      "file": "content-graph-evidence.json",
      "sha256": "3d39a1bc5cbe7f8fb41752e74b5e45713f04ff130b3344570dbd9d7d68b9d23c",
      "size": 63462,
      "runtimeTarget": "content-graph",
      "buildMode": "generated",
      "contains": [],
      "schemaVersion": "echo.content_graph.evidence.v1",
      "url": "https://github.com/knoxhack/ECHO-Modules/releases/download/modules-content-graph-evidence-proof-20260615/content-graph-evidence.json",
      "artifactRole": "content-graph-evidence"
    }
  },
  "dependencies": [
    {
      "id": "echoadaptercore",
      "kind": "module",
      "version": "*"
    },
    {
      "id": "echocore",
      "kind": "module",
      "version": "*"
    },
    {
      "id": "echonetcore",
      "kind": "module",
      "version": "*"
    }
  ],
  "compatibility": [
    "ashfall-neoforge-edition",
    "ashfall-standalone-edition",
    "ashfall-native-edition"
  ],
  "provenance": {
    "sourceRepo": "knoxhack/ECHO-Modules",
    "commitSha": "88d17f50dc14915ab3ea21802490bc5e43a69550",
    "workflow": "Release Modules",
    "workflowRef": "knoxhack/ECHO-Modules/.github/workflows/release-modules.yml@refs/heads/main",
    "generatedBy": "scripts/generate-module-release.mjs",
    "attestation": {
      "action": "actions/attest@v4",
      "subjectChecksums": "echo-module-release.tar.gz.sha256"
    }
  },
  "trust": "provenance-attested",
  "validation": "approved"
}
