{
    "channel":  "alpha",
    "publisher":  "knoxhack",
    "sourceRepo":  "knoxhack/ECHO-Modules",
    "releaseTag":  "modules-all-official-modpacks-runtime-fix-20260614",
    "commitSha":  "0beb164098526cf791cc6c649704e6a434769a17",
    "trust":  "source-linked",
    "validation":  "approved",
    "id":  "echoplatformcore",
    "kind":  "module",
    "version":  "1.0.0",
    "artifacts":  {
                      "neoforge":  {
                                       "file":  "echoplatformcore-1.0.0-neoforge.jar",
                                       "sha256":  "059c34555f1192db811c6fdaf7f4a87571c660038171f75430e0221c2ffcebaa",
                                       "url":  "https://github.com/knoxhack/ECHO-Modules/releases/download/modules-all-official-modpacks-runtime-fix-20260614/echoplatformcore-1.0.0-neoforge.jar",
                                       "size":  46638,
                                       "buildMode":  "compiled-runtime"
                                   },
                      "standalone":  {
                                         "file":  "echoplatformcore-1.0.0-standalone.jar",
                                         "sha256":  "3c7cd0fab24506d211dadcb6774948acabe657cb89666767ccc2fd748ce76b51",
                                         "url":  "https://github.com/knoxhack/ECHO-Modules/releases/download/modules-all-official-modpacks-runtime-fix-20260614/echoplatformcore-1.0.0-standalone.jar",
                                         "size":  46626,
                                         "buildMode":  "compiled-runtime"
                                     },
                      "native":  {
                                     "file":  "echoplatformcore-1.0.0.echo-addon",
                                     "sha256":  "848e3680f79fe5fec2a37bdb1d62be7bd34af7adb4607d43b72afaa34f872bcf",
                                     "url":  "https://github.com/knoxhack/ECHO-Modules/releases/download/modules-all-official-modpacks-runtime-fix-20260614/echoplatformcore-1.0.0.echo-addon",
                                     "size":  45215,
                                     "buildMode":  "compiled-runtime"
                                 },
                      "sources":  {
                                      "file":  "echoplatformcore-1.0.0-sources.jar",
                                      "sha256":  "470cb04cf7b4a9a791583c904b6007de965c88f4884fdc7480ee82b418dabf0a",
                                      "url":  "https://github.com/knoxhack/ECHO-Modules/releases/download/modules-all-official-modpacks-runtime-fix-20260614/echoplatformcore-1.0.0-sources.jar",
                                      "size":  20848
                                  }
                  },
    "dependencies":  [
                         {
                             "id":  "echocore",
                             "kind":  "module"
                         }
                     ],
    "compatibility":  [

                      ]
}
