{
    "channel":  "alpha",
    "publisher":  "knoxhack",
    "sourceRepo":  "knoxhack/ECHO-Modules",
    "releaseTag":  "modules-all-official-modpacks-runtime-fix-20260614",
    "commitSha":  "0beb164098526cf791cc6c649704e6a434769a17",
    "trust":  "source-linked",
    "validation":  "approved",
    "id":  "echoprogressioncore",
    "kind":  "module",
    "version":  "1.0.0",
    "artifacts":  {
                      "neoforge":  {
                                       "file":  "echoprogressioncore-1.0.0-neoforge.jar",
                                       "sha256":  "a6a977253e3562806a69a6a46439c80caafffa05183c8f1ae77b2f19d0ca2f77",
                                       "url":  "https://github.com/knoxhack/ECHO-Modules/releases/download/modules-all-official-modpacks-runtime-fix-20260614/echoprogressioncore-1.0.0-neoforge.jar",
                                       "size":  46387,
                                       "buildMode":  "compiled-runtime"
                                   },
                      "standalone":  {
                                         "file":  "echoprogressioncore-1.0.0-standalone.jar",
                                         "sha256":  "d935f701f22161f9035b04a565a3c53cf22655f1a1ed4673c045fbd0ac6ed739",
                                         "url":  "https://github.com/knoxhack/ECHO-Modules/releases/download/modules-all-official-modpacks-runtime-fix-20260614/echoprogressioncore-1.0.0-standalone.jar",
                                         "size":  46378,
                                         "buildMode":  "compiled-runtime"
                                     },
                      "native":  {
                                     "file":  "echoprogressioncore-1.0.0.echo-addon",
                                     "sha256":  "74f0fff94615b2a7467b99755becb3efd938444b2628ab0f567ec55194f2df25",
                                     "url":  "https://github.com/knoxhack/ECHO-Modules/releases/download/modules-all-official-modpacks-runtime-fix-20260614/echoprogressioncore-1.0.0.echo-addon",
                                     "size":  46252,
                                     "buildMode":  "compiled-runtime"
                                 },
                      "sources":  {
                                      "file":  "echoprogressioncore-1.0.0-sources.jar",
                                      "sha256":  "7ac45bc1f98a17dfd1cec3d26968978acf7bb1ad529f1355bbb69fe399929163",
                                      "url":  "https://github.com/knoxhack/ECHO-Modules/releases/download/modules-all-official-modpacks-runtime-fix-20260614/echoprogressioncore-1.0.0-sources.jar",
                                      "size":  20431
                                  }
                  },
    "dependencies":  [
                         {
                             "id":  "echoadaptercore",
                             "kind":  "module"
                         },
                         {
                             "id":  "echocontentcore",
                             "kind":  "module"
                         },
                         {
                             "id":  "echocore",
                             "kind":  "module"
                         },
                         {
                             "id":  "echoplatformcore",
                             "kind":  "module"
                         },
                         {
                             "id":  "echorecipecore",
                             "kind":  "module"
                         },
                         {
                             "id":  "echoschemacore",
                             "kind":  "module"
                         },
                         {
                             "id":  "echovalidationcore",
                             "kind":  "module"
                         }
                     ],
    "compatibility":  [

                      ]
}
