{
  "channel": "alpha",
  "publisher": "knoxhack",
  "sourceRepo": "knoxhack/ECHO-Modules",
  "releaseTag": "modules-all-official-modpacks-install-fix-20260613",
  "commitSha": "a2e0823ba175b79be9a67031f7b6da77159720a1",
  "trust": "source-linked",
  "validation": "approved",
  "id": "echohudcore",
  "kind": "module",
  "version": "1.0.0",
  "artifacts": {
    "neoforge": {
      "file": "echohudcore-1.0.0-neoforge.jar",
      "sha256": "b236ec60e4a130d9b3904d979a624e023e08488161130165ee4ae127d065b790",
      "url": "https://github.com/knoxhack/ECHO-Modules/releases/download/modules-all-official-modpacks-install-fix-20260613/echohudcore-1.0.0-neoforge.jar",
      "size": 46538,
      "buildMode": "compiled-runtime"
    },
    "standalone": {
      "file": "echohudcore-1.0.0-standalone.jar",
      "sha256": "e66159111bf5bd3d800c8a0b7cfc10359c15246abdb5543e7a775da6fad925e6",
      "url": "https://github.com/knoxhack/ECHO-Modules/releases/download/modules-all-official-modpacks-install-fix-20260613/echohudcore-1.0.0-standalone.jar",
      "size": 46517,
      "buildMode": "compiled-runtime"
    },
    "native": {
      "file": "echohudcore-1.0.0.echo-addon",
      "sha256": "0f67749e5d7e7341345f073585d069664de5ab2dbc5189dc11a8a7f217d93b47",
      "url": "https://github.com/knoxhack/ECHO-Modules/releases/download/modules-all-official-modpacks-install-fix-20260613/echohudcore-1.0.0.echo-addon",
      "size": 47291,
      "buildMode": "compiled-runtime"
    },
    "sources": {
      "file": "echohudcore-1.0.0-sources.jar",
      "sha256": "54a8cd23dec9e6bce9e451ac21db59cb7114e5a71072fa1b27091a03d9f41d6b",
      "url": "https://github.com/knoxhack/ECHO-Modules/releases/download/modules-all-official-modpacks-install-fix-20260613/echohudcore-1.0.0-sources.jar",
      "size": 21709
    }
  },
  "dependencies": [
    {
      "id": "echoadaptercore",
      "kind": "module"
    },
    {
      "id": "echocontentcore",
      "kind": "module"
    },
    {
      "id": "echocore",
      "kind": "module"
    },
    {
      "id": "echoplatformcore",
      "kind": "module"
    },
    {
      "id": "echoschemacore",
      "kind": "module"
    },
    {
      "id": "echovalidationcore",
      "kind": "module"
    }
  ],
  "compatibility": [
    "ashfall-native-edition",
    "ashfall-neoforge-edition",
    "ashfall-standalone-edition",
    "sky-relay-native-edition",
    "sky-relay-neoforge-edition",
    "sky-relay-standalone-edition",
    "galactic-survey-native-edition",
    "galactic-survey-neoforge-edition",
    "galactic-survey-standalone-edition",
    "openlands-native-edition",
    "openlands-neoforge-edition",
    "openlands-standalone-edition",
    "arcana-division-native-edition",
    "arcana-division-neoforge-edition",
    "arcana-division-standalone-edition"
  ]
}
