{
  "id": "echotelemetrycore",
  "kind": "module",
  "version": "0.1.0",
  "channel": "alpha",
  "publisher": "knoxhack",
  "sourceRepo": "knoxhack/ECHO-Modules",
  "releaseTag": "modules-content-graph-evidence-repro-20260616",
  "commitSha": "aff012aaa427f6f8b5eaf10e145207739b1602b7",
  "artifacts": {
    "neoforge": {
      "file": "echotelemetrycore-0.1.0-neoforge.jar",
      "sha256": "3a58bc1c561905cb1919ffac4923fbe9a8781f8ab5ba31cc6a743f7afffa3e35",
      "size": 11807,
      "runtimeTarget": "neoforge",
      "buildMode": "compiled-runtime",
      "contains": [
        "META-INF/echo.mod.json",
        "META-INF/neoforge.mods.toml",
        ".echo/content-graph/content-graph.json",
        ".echo/content-graph/content-graph.md",
        ".echo/content-graph/export-plans/echo_native.json",
        ".echo/content-graph/export-plans/echo_runtime_standalone.json",
        ".echo/content-graph/export-plans/hytale.json",
        ".echo/content-graph/export-plans/neoforge.json",
        ".echo/content-graph/features.json",
        ".echo/content-graph/provenance.json",
        ".echo/content-graph/unresolved-references.json"
      ],
      "url": "https://github.com/knoxhack/ECHO-Modules/releases/download/modules-content-graph-evidence-repro-20260616/echotelemetrycore-0.1.0-neoforge.jar"
    },
    "standalone": {
      "file": "echotelemetrycore-0.1.0-standalone.jar",
      "sha256": "3a58bc1c561905cb1919ffac4923fbe9a8781f8ab5ba31cc6a743f7afffa3e35",
      "size": 11807,
      "runtimeTarget": "standalone",
      "buildMode": "compiled-runtime",
      "contains": [
        "META-INF/echo.mod.json",
        ".echo/content-graph/content-graph.json",
        ".echo/content-graph/content-graph.md",
        ".echo/content-graph/export-plans/echo_native.json",
        ".echo/content-graph/export-plans/echo_runtime_standalone.json",
        ".echo/content-graph/export-plans/hytale.json",
        ".echo/content-graph/export-plans/neoforge.json",
        ".echo/content-graph/features.json",
        ".echo/content-graph/provenance.json",
        ".echo/content-graph/unresolved-references.json"
      ],
      "url": "https://github.com/knoxhack/ECHO-Modules/releases/download/modules-content-graph-evidence-repro-20260616/echotelemetrycore-0.1.0-standalone.jar"
    },
    "native": {
      "file": "echotelemetrycore-0.1.0.echo-addon",
      "sha256": "67c71aa616b869fc681cd156fca5f0e6623e3617dc34c7f3bf94e01a7a8ed248",
      "size": 14737,
      "runtimeTarget": "echo-native",
      "buildMode": "compiled-runtime",
      "contains": [
        "META-INF/echo.mod.json",
        "echo-addon-package.json",
        "checksums.sha256",
        ".echo/content-graph/content-graph.json",
        ".echo/content-graph/content-graph.md",
        ".echo/content-graph/export-plans/echo_native.json",
        ".echo/content-graph/export-plans/echo_runtime_standalone.json",
        ".echo/content-graph/export-plans/hytale.json",
        ".echo/content-graph/export-plans/neoforge.json",
        ".echo/content-graph/features.json",
        ".echo/content-graph/provenance.json",
        ".echo/content-graph/unresolved-references.json"
      ],
      "url": "https://github.com/knoxhack/ECHO-Modules/releases/download/modules-content-graph-evidence-repro-20260616/echotelemetrycore-0.1.0.echo-addon"
    },
    "sources": {
      "file": "echotelemetrycore-0.1.0-sources.jar",
      "sha256": "7679dfcbe75b8aaebbc96642e6539911c25d3280010eb7dddbd8cd49d00f7da9",
      "size": 5855,
      "runtimeTarget": "sources",
      "contains": [
        "META-INF/echo.mod.json"
      ],
      "url": "https://github.com/knoxhack/ECHO-Modules/releases/download/modules-content-graph-evidence-repro-20260616/echotelemetrycore-0.1.0-sources.jar"
    },
    "content-graph": {
      "file": "echotelemetrycore-0.1.0-content-graph.json",
      "sha256": "3231356512abdee7a835c0d2f10cba3d67280bd11eb1697f19f3dc2c8b63dfb3",
      "size": 18658,
      "runtimeTarget": "content-graph",
      "buildMode": "generated",
      "contains": [
        ".echo/content-graph/content-graph.json"
      ],
      "url": "https://github.com/knoxhack/ECHO-Modules/releases/download/modules-content-graph-evidence-repro-20260616/echotelemetrycore-0.1.0-content-graph.json"
    },
    "content-graph-evidence": {
      "file": "content-graph-evidence.json",
      "sha256": "e366172d6fb5d09e6d9cb749698ac51bd536ba6fcd2f84c1cf0ab5169665aa20",
      "size": 63462,
      "runtimeTarget": "content-graph",
      "buildMode": "generated",
      "contains": [],
      "schemaVersion": "echo.content_graph.evidence.v1",
      "url": "https://github.com/knoxhack/ECHO-Modules/releases/download/modules-content-graph-evidence-repro-20260616/content-graph-evidence.json",
      "artifactRole": "content-graph-evidence"
    }
  },
  "dependencies": [
    {
      "id": "echocore",
      "kind": "module",
      "version": "*"
    },
    {
      "id": "echoadaptercore",
      "kind": "module",
      "version": "*"
    },
    {
      "id": "echopolicycore",
      "kind": "module",
      "version": "*"
    },
    {
      "id": "echoreportcore",
      "kind": "module",
      "version": "*"
    },
    {
      "id": "echoplaytestcore",
      "kind": "module",
      "version": "*"
    }
  ],
  "compatibility": [
    "ashfall-neoforge-edition",
    "ashfall-standalone-edition",
    "ashfall-native-edition"
  ],
  "provenance": {
    "sourceRepo": "knoxhack/ECHO-Modules",
    "commitSha": "aff012aaa427f6f8b5eaf10e145207739b1602b7",
    "workflow": "Release Modules",
    "workflowRef": "knoxhack/ECHO-Modules/.github/workflows/release-modules.yml@refs/heads/main",
    "generatedBy": "scripts/generate-module-release.mjs",
    "attestation": {
      "action": "actions/attest@v4",
      "subjectChecksums": "echo-module-release.tar.gz.sha256"
    }
  },
  "trust": "provenance-attested",
  "validation": "approved"
}
