{
    "channel":  "alpha",
    "publisher":  "knoxhack",
    "sourceRepo":  "knoxhack/ECHO-Modules",
    "releaseTag":  "modules-all-official-modpacks-runtime-fix-20260614",
    "commitSha":  "0beb164098526cf791cc6c649704e6a434769a17",
    "trust":  "source-linked",
    "validation":  "approved",
    "id":  "echopresencelink",
    "kind":  "module",
    "version":  "1.0.0",
    "artifacts":  {
                      "neoforge":  {
                                       "file":  "echopresencelink-1.0.0-neoforge.jar",
                                       "sha256":  "7f2de41b05aed565e0df55858578944ec9be82cdc05a04f87639d0c12e5bed6d",
                                       "url":  "https://github.com/knoxhack/ECHO-Modules/releases/download/modules-all-official-modpacks-runtime-fix-20260614/echopresencelink-1.0.0-neoforge.jar",
                                       "size":  10139019,
                                       "buildMode":  "compiled-runtime"
                                   },
                      "standalone":  {
                                         "file":  "echopresencelink-1.0.0-standalone.jar",
                                         "sha256":  "f9ab16ca832daa01239d52a522c2d4d4312001ac5062ba91216d5f6ef332c0fa",
                                         "url":  "https://github.com/knoxhack/ECHO-Modules/releases/download/modules-all-official-modpacks-runtime-fix-20260614/echopresencelink-1.0.0-standalone.jar",
                                         "size":  10139011,
                                         "buildMode":  "compiled-runtime"
                                     },
                      "native":  {
                                     "file":  "echopresencelink-1.0.0.echo-addon",
                                     "sha256":  "f0d0934295bf6beb2726eba77c886b797e150d108ee83701d9cab7f17790b87c",
                                     "url":  "https://github.com/knoxhack/ECHO-Modules/releases/download/modules-all-official-modpacks-runtime-fix-20260614/echopresencelink-1.0.0.echo-addon",
                                     "size":  10140620,
                                     "buildMode":  "compiled-runtime"
                                 },
                      "sources":  {
                                      "file":  "echopresencelink-1.0.0-sources.jar",
                                      "sha256":  "549b65942468150936c73401c4f60d5c1bf08c459da7e6a7fc1a2c098e49b985",
                                      "url":  "https://github.com/knoxhack/ECHO-Modules/releases/download/modules-all-official-modpacks-runtime-fix-20260614/echopresencelink-1.0.0-sources.jar",
                                      "size":  10103063
                                  }
                  },
    "dependencies":  [
                         {
                             "id":  "echoadaptercore",
                             "kind":  "module"
                         },
                         {
                             "id":  "echocore",
                             "kind":  "module"
                         }
                     ],
    "compatibility":  [

                      ]
}
