{
  "id": "echoexpeditioncore",
  "kind": "module",
  "version": "0.1.0",
  "channel": "alpha",
  "publisher": "knoxhack",
  "sourceRepo": "knoxhack/ECHO-Modules",
  "releaseTag": "modules-content-graph-evidence-proof-20260615",
  "commitSha": "88d17f50dc14915ab3ea21802490bc5e43a69550",
  "artifacts": {
    "neoforge": {
      "file": "echoexpeditioncore-0.1.0-neoforge.jar",
      "sha256": "2981388d748dbc9057fd22cc6796b039f074377769e1d175aed114b83297579e",
      "size": 11797,
      "runtimeTarget": "neoforge",
      "buildMode": "compiled-runtime",
      "contains": [
        "META-INF/echo.mod.json",
        "META-INF/neoforge.mods.toml",
        ".echo/content-graph/content-graph.json",
        ".echo/content-graph/content-graph.md",
        ".echo/content-graph/export-plans/echo_native.json",
        ".echo/content-graph/export-plans/echo_runtime_standalone.json",
        ".echo/content-graph/export-plans/hytale.json",
        ".echo/content-graph/export-plans/neoforge.json",
        ".echo/content-graph/features.json",
        ".echo/content-graph/provenance.json",
        ".echo/content-graph/unresolved-references.json"
      ],
      "url": "https://github.com/knoxhack/ECHO-Modules/releases/download/modules-content-graph-evidence-proof-20260615/echoexpeditioncore-0.1.0-neoforge.jar"
    },
    "standalone": {
      "file": "echoexpeditioncore-0.1.0-standalone.jar",
      "sha256": "2981388d748dbc9057fd22cc6796b039f074377769e1d175aed114b83297579e",
      "size": 11797,
      "runtimeTarget": "standalone",
      "buildMode": "compiled-runtime",
      "contains": [
        "META-INF/echo.mod.json",
        ".echo/content-graph/content-graph.json",
        ".echo/content-graph/content-graph.md",
        ".echo/content-graph/export-plans/echo_native.json",
        ".echo/content-graph/export-plans/echo_runtime_standalone.json",
        ".echo/content-graph/export-plans/hytale.json",
        ".echo/content-graph/export-plans/neoforge.json",
        ".echo/content-graph/features.json",
        ".echo/content-graph/provenance.json",
        ".echo/content-graph/unresolved-references.json"
      ],
      "url": "https://github.com/knoxhack/ECHO-Modules/releases/download/modules-content-graph-evidence-proof-20260615/echoexpeditioncore-0.1.0-standalone.jar"
    },
    "native": {
      "file": "echoexpeditioncore-0.1.0.echo-addon",
      "sha256": "a355e67087e060365ed6ab5505261045bc48ff6fd164a57800729f6d74055d28",
      "size": 14680,
      "runtimeTarget": "echo-native",
      "buildMode": "compiled-runtime",
      "contains": [
        "META-INF/echo.mod.json",
        "echo-addon-package.json",
        "checksums.sha256",
        ".echo/content-graph/content-graph.json",
        ".echo/content-graph/content-graph.md",
        ".echo/content-graph/export-plans/echo_native.json",
        ".echo/content-graph/export-plans/echo_runtime_standalone.json",
        ".echo/content-graph/export-plans/hytale.json",
        ".echo/content-graph/export-plans/neoforge.json",
        ".echo/content-graph/features.json",
        ".echo/content-graph/provenance.json",
        ".echo/content-graph/unresolved-references.json"
      ],
      "url": "https://github.com/knoxhack/ECHO-Modules/releases/download/modules-content-graph-evidence-proof-20260615/echoexpeditioncore-0.1.0.echo-addon"
    },
    "sources": {
      "file": "echoexpeditioncore-0.1.0-sources.jar",
      "sha256": "055404aa581f2115245c56dc7f80a6a659372b565d1e0b67b2f17d2e025a5626",
      "size": 5762,
      "runtimeTarget": "sources",
      "contains": [
        "META-INF/echo.mod.json"
      ],
      "url": "https://github.com/knoxhack/ECHO-Modules/releases/download/modules-content-graph-evidence-proof-20260615/echoexpeditioncore-0.1.0-sources.jar"
    },
    "content-graph": {
      "file": "echoexpeditioncore-0.1.0-content-graph.json",
      "sha256": "01d0dd28b0fa49670f4ecf3ca6f31a6d9f4dc2e3021e2b02793b708f6f51d9d9",
      "size": 19871,
      "runtimeTarget": "content-graph",
      "buildMode": "generated",
      "contains": [
        ".echo/content-graph/content-graph.json"
      ],
      "url": "https://github.com/knoxhack/ECHO-Modules/releases/download/modules-content-graph-evidence-proof-20260615/echoexpeditioncore-0.1.0-content-graph.json"
    },
    "content-graph-evidence": {
      "file": "content-graph-evidence.json",
      "sha256": "3d39a1bc5cbe7f8fb41752e74b5e45713f04ff130b3344570dbd9d7d68b9d23c",
      "size": 63462,
      "runtimeTarget": "content-graph",
      "buildMode": "generated",
      "contains": [],
      "schemaVersion": "echo.content_graph.evidence.v1",
      "url": "https://github.com/knoxhack/ECHO-Modules/releases/download/modules-content-graph-evidence-proof-20260615/content-graph-evidence.json",
      "artifactRole": "content-graph-evidence"
    }
  },
  "dependencies": [
    {
      "id": "echocore",
      "kind": "module",
      "version": "*"
    },
    {
      "id": "echoadaptercore",
      "kind": "module",
      "version": "*"
    },
    {
      "id": "echosessioncore",
      "kind": "module",
      "version": "*"
    },
    {
      "id": "echohazardcore",
      "kind": "module",
      "version": "*"
    },
    {
      "id": "echomissioncore",
      "kind": "module",
      "version": "*"
    },
    {
      "id": "echoworldcore",
      "kind": "module",
      "version": "*"
    }
  ],
  "compatibility": [
    "ashfall-neoforge-edition",
    "ashfall-standalone-edition",
    "ashfall-native-edition"
  ],
  "provenance": {
    "sourceRepo": "knoxhack/ECHO-Modules",
    "commitSha": "88d17f50dc14915ab3ea21802490bc5e43a69550",
    "workflow": "Release Modules",
    "workflowRef": "knoxhack/ECHO-Modules/.github/workflows/release-modules.yml@refs/heads/main",
    "generatedBy": "scripts/generate-module-release.mjs",
    "attestation": {
      "action": "actions/attest@v4",
      "subjectChecksums": "echo-module-release.tar.gz.sha256"
    }
  },
  "trust": "provenance-attested",
  "validation": "approved"
}
