{
  "channel": "alpha",
  "publisher": "knoxhack",
  "sourceRepo": "knoxhack/ECHO-Modules",
  "releaseTag": "modules-all-official-modpacks-install-fix-20260613",
  "commitSha": "a2e0823ba175b79be9a67031f7b6da77159720a1",
  "trust": "source-linked",
  "validation": "approved",
  "id": "echosocialcore",
  "kind": "module",
  "version": "1.0.0",
  "artifacts": {
    "neoforge": {
      "file": "echosocialcore-1.0.0-neoforge.jar",
      "sha256": "9b1711be05cc6921c8f06e144bf56f89b59ef73d52d05bba28fb49b972b0ceb3",
      "url": "https://github.com/knoxhack/ECHO-Modules/releases/download/modules-all-official-modpacks-install-fix-20260613/echosocialcore-1.0.0-neoforge.jar",
      "size": 57114,
      "buildMode": "compiled-runtime"
    },
    "standalone": {
      "file": "echosocialcore-1.0.0-standalone.jar",
      "sha256": "237a1b9a21f40e83f339cef950fcdd7ed1be3daac022a72540ca47df9ce89d5b",
      "url": "https://github.com/knoxhack/ECHO-Modules/releases/download/modules-all-official-modpacks-install-fix-20260613/echosocialcore-1.0.0-standalone.jar",
      "size": 57094,
      "buildMode": "compiled-runtime"
    },
    "native": {
      "file": "echosocialcore-1.0.0.echo-addon",
      "sha256": "5952ed911545ad1134621ec804d1f879e217888bce2a29978542858558ac90c6",
      "url": "https://github.com/knoxhack/ECHO-Modules/releases/download/modules-all-official-modpacks-install-fix-20260613/echosocialcore-1.0.0.echo-addon",
      "size": 55903,
      "buildMode": "compiled-runtime"
    },
    "sources": {
      "file": "echosocialcore-1.0.0-sources.jar",
      "sha256": "4b64cad553b5f89ce34240e3216709bfce8fb3795429b6eec7d282839698a63d",
      "url": "https://github.com/knoxhack/ECHO-Modules/releases/download/modules-all-official-modpacks-install-fix-20260613/echosocialcore-1.0.0-sources.jar",
      "size": 24347
    }
  },
  "dependencies": [
    {
      "id": "echoadaptercore",
      "kind": "module"
    },
    {
      "id": "echocontentcore",
      "kind": "module"
    },
    {
      "id": "echocore",
      "kind": "module"
    },
    {
      "id": "echoplatformcore",
      "kind": "module"
    },
    {
      "id": "echoprogressioncore",
      "kind": "module"
    },
    {
      "id": "echoschemacore",
      "kind": "module"
    },
    {
      "id": "echovalidationcore",
      "kind": "module"
    }
  ],
  "compatibility": [
    "ashfall-native-edition",
    "ashfall-neoforge-edition",
    "ashfall-standalone-edition",
    "sky-relay-native-edition",
    "sky-relay-neoforge-edition",
    "sky-relay-standalone-edition",
    "galactic-survey-native-edition",
    "galactic-survey-neoforge-edition",
    "galactic-survey-standalone-edition",
    "openlands-native-edition",
    "openlands-neoforge-edition",
    "openlands-standalone-edition",
    "arcana-division-native-edition",
    "arcana-division-neoforge-edition",
    "arcana-division-standalone-edition"
  ]
}
